{
  "batch_schema_version": 1,
  "batch_id": "018f2c1a-batch-legacy-1",
  "received_at": "2026-09-14T18:03:12.100000Z",
  "ack_through_index": -1,
  "counts": {
    "submitted": 2,
    "accepted": 0,
    "duplicate": 0,
    "refused": 0,
    "deferred": 2
  },
  "results": [
    {
      "index": 0,
      "status": "deferred",
      "event_id": null,
      "dispatchable": false,
      "reasons": [],
      "raw_ref": null,
      "classification": "translation_required"
    },
    {
      "index": 1,
      "status": "deferred",
      "event_id": null,
      "dispatchable": false,
      "reasons": [],
      "raw_ref": null,
      "classification": "translation_required"
    }
  ],
  "retry_after_s": null,
  "server": {
    "adapter": "ingest-batch",
    "version": "0.1.0-design",
    "envelope_major": 1
  }
}
